Timestamp,First Name,Gift 1,Gift 2,Gift 3,Gift 4 (optional),Gift 5 (optional),Email Address
8/5/2023 12:08:14,Krysta,Bath and body works candles,Pink Nike or Adidas bucket hat,Bombshell perfume from Victoria’s Secret,A big fluffy blanket,Pink fuzzy slippers,
10/25/2023 12:48:13,Eileen,Touch of class vive bene grape banner and wall accent,Harvest elie slim heirloom salad kit in stainless or black,Ovente red electric 3.7 quart mixee in red,5 layer jewelry bx organizer in black,Outdoor battery lantern for patio,
11/15/2023 16:57:55,Michael,BBQ Gloves,Ovcer the sink drying rack,Size 10.5 tennis shoes Black,Organizer for spices,Desk Chair,mdohse29@gmail.com
11/19/2023 10:18:31,Ryan,"Outdoor 50 foot globe patio light, G40 Led","LED Vintage Lantern Flickering Flame, Indoor/Outdoor Hanging lantern","Vintage 60's - 80's 8 x 10 tin signs, movies or music, or nostalgic theme",,,azcardsfan12@gmail.com
11/20/2023 11:31:41,Wayne,Navy veteran sweatshirt xxl (no hood),US Navy long sleeve t-shirt xxl,US Navy adjustable ball cap,zeakoc power tool organizer for wall,,mamamia1749@yahoo.com
12/5/2023 20:46:16,Sabrina,"Black 3 light arc floor lamp, hanging over the couch from Amazon ",Silky Soft Pintuck King 8 piece Comforter set Bed in a Bag in Black from Walmart,Black Industrial touch table lamps set of 2 with glass lampshade and USB port and outlet from Amazon,HB Tower Black 3 step ladder lightweight folding portable step stool,9x13 Rectangle Stoneware Baking Dish- Cream Color by Figment at Target,slwd34@yahoo.com
12/7/2023 19:57:19,Collin,white kyler murray youth XL jersey ,"black, maroon, gold asu t shirts L",all white slip on vans size 8.5,nba 2k24 xbox one,"ford tshirts L, hoodie M, keychain",cdohse2003@gmail.com
12/9/2023 13:27:44,Alec ,Loose Boxers,Tight workout shirts ,White Nikes/Addidas ,Jeep accessories ,Black socks foot only no ankle ,squeal_drier.0l@icloud.com